{"content_status":"partial","counts":{"eligible_articles":7,"fetched":11,"held":0,"merged_duplicates":0,"published_topics":7},"coverage":{"expected_sources":3,"partial":true,"successful_sources":1},"headline_summary":["노정규 현대로오텍 대표 “42년 전기 외길, 기술로 세우고 안전으로 완성”","재생E 220GW 확대 실현 가능한가…부지 확보·계통 등 과제 수두룩","바람과 햇빛으로 살아나는 섬…한전, 제주 가파도에 RE100 조성"],"issue_date":"2026-09-30","issue_id":"wind-2026-09-30","items":[{"amount":null,"capacity":null,"capacity_unit":null,"companies":["현대로오텍"],"contract_stage":"미확인","currency":null,"event_id":"evt-82a3e8b3ff2a4c015e1fdf2c","evidence_scope":"full_text","headline":"노정규 현대로오텍 대표 “42년 전기 외길, 기술로 세우고 안전으로 완성”","late_arrival":false,"primary_category":"EPC·시공","project_name":null,"region":null,"representative_article_id":"962f4be93cef67ea821b92ff8bb2759d58a84da4595344ad4ca5b11e0bc3fa89","source_name":"전기신문","source_published_at":"2026-09-29T00:54:06+00:00","source_url":"https://www.electimes.com/news/articleView.html?idxno=372814","summary":"이후 전력설비 시공과 배전반 제작에서 출발해 변전소 시공, 태양광·풍력 등 신재생에너지와 에너지저장장치(ESS) 관련 기술까지 사업 영역을 넓혔다.","tags":[],"timestamp_basis":"publisher_article_meta","wind_type":"공통"},{"amount":null,"capacity":null,"capacity_unit":null,"companies":[],"contract_stage":"미확인","currency":null,"event_id":"evt-95670faa50871d2f2b9eb7d8","evidence_scope":"full_text","headline":"재생E 220GW 확대 실현 가능한가…부지 확보·계통 등 과제 수두룩","late_arrival":true,"primary_category":"금융·PF","project_name":null,"region":"국내","representative_article_id":"ca9d422ac93856d7f6e3096f3baef342398821a0902f4a6a63d920cb7ec2567f","source_name":"전기신문","source_published_at":"2026-09-28T02:21:19+00:00","source_url":"https://www.electimes.com/news/articleView.html?idxno=371724","summary":"2025년 0.4GW에 불과한 해상풍력을 2040년 45GW로 100배 이상이나 확대한다는 목표를 제시했다. 육상풍력도 2GW에서 16GW로 확대할 계획으로 이 역시 이미 허가받은 8.1GW와, 새로 추진할 5GW 등을 감안했다.","tags":[],"timestamp_basis":"publisher_article_meta","wind_type":"고정식 해상"},{"amount":null,"capacity":null,"capacity_unit":null,"companies":["한국전력"],"contract_stage":"미확인","currency":null,"event_id":"evt-1a9a46b7037253cfabcfd5d3","evidence_scope":"full_text","headline":"바람과 햇빛으로 살아나는 섬…한전, 제주 가파도에 RE100 조성","late_arrival":true,"primary_category":"민원·수용성","project_name":"RE100(사용전력 100% 재생에너지 전환) 마을 조성 실증사업","region":"제주특별자치도 서귀포시 가파도","representative_article_id":"70dc4b547828528531c1d23b843691e0a853701a7c48f0652538b6edc4983179","source_name":"전기신문","source_published_at":"2026-09-28T01:33:28+00:00","source_url":"https://www.electimes.com/news/articleView.html?idxno=372825","summary":"한국전력은 제주특별자치도 서귀포시 가파도를 대상으로 ‘RE100(사용전력 100% 재생에너지 전환) 마을 조성 실증사업’을 본격 추진한다고 28일 밝혔다. 이와 관련 오는 2027년까지 가파도에 ESS와 태양광·풍력 발전설비 구축을 완료할 계획이다.","tags":[],"timestamp_basis":"publisher_article_meta","wind_type":"공통"},{"amount":null,"capacity":null,"capacity_unit":null,"companies":[],"contract_stage":"검토","currency":null,"event_id":"evt-5fba6a3153f2941ae0a622b7","evidence_scope":"full_text","headline":"“전력망 더 짓기 전에 있는 망부터 사용”…재생E 100GW 길 연다","late_arrival":false,"primary_category":"사고·안전","project_name":null,"region":"호남권","representative_article_id":"8a025706bc70297373f902bd689eac560f32ac5e440816783240e0e8cf60f9ed","source_name":"전기신문","source_published_at":"2026-09-29T05:10:47+00:00","source_url":"https://www.electimes.com/news/articleView.html?idxno=372883","summary":"특히 호남권에서는 지연된 해상풍력 사업 등을 대상으로 2030년까지 10GW 이상의 접속권을 추가로 회수할 수 있을 것으로 전망했다.","tags":["검토"],"timestamp_basis":"publisher_article_meta","wind_type":"고정식 해상"},{"amount":null,"capacity":null,"capacity_unit":null,"companies":[],"contract_stage":"검토","currency":null,"event_id":"evt-3883791aa36bdb1acea4feba","evidence_scope":"full_text","headline":"고동휘 KIOST 책임연구원 “해상풍력, 어민 보상 넘어 함께 돈 버는 바다로”","late_arrival":false,"primary_category":"사고·안전","project_name":"서남해 해상풍력 실증단지","region":"서남해","representative_article_id":"1144d3fafbfaa9353a590cf0d605adba59b9aef397a47dab51a2ec37d4325f18","source_name":"전기신문","source_published_at":"2026-09-29T22:00:00+00:00","source_url":"https://www.electimes.com/news/articleView.html?idxno=372807","summary":"KIOST는 복합양식 실증을 통해 비단가리비 등의 생산 가능성을 확인했다. 하지만 실해역에서 가능성을 확인한 것과 사업성을 확보한 것은 별개의 문제다.","tags":["검토"],"timestamp_basis":"publisher_article_meta","wind_type":"고정식 해상"},{"amount":null,"capacity":null,"capacity_unit":null,"companies":[],"contract_stage":"검토","currency":null,"event_id":"evt-b4de47079ff95613e3efd40f","evidence_scope":"full_text","headline":"(특별기고)정의로운 에너지로 전환하는 인천","late_arrival":true,"primary_category":"인허가·정책","project_name":"해상풍력 집화단지","region":"인천","representative_article_id":"d913a30216dad64944ef881ef00a8b985b8f67ec35b0caf09870e3bf3a25414e","source_name":"전기신문","source_published_at":"2026-09-28T02:34:40+00:00","source_url":"https://www.electimes.com/news/articleView.html?idxno=372818","summary":"특히 내년도 주요 사업 예산에 영흥 친환경 에너지 파크 조성, 해상풍력 집화단지, 에너지기술공유대학 등 인천의 미래 성장 동력 확보를 위한 투자 의지를 나타냈다.","tags":["검토"],"timestamp_basis":"publisher_article_meta","wind_type":"고정식 해상"},{"amount":null,"capacity":null,"capacity_unit":null,"companies":[],"contract_stage":"미확인","currency":null,"event_id":"evt-c6bac31a4f7b45ac3e9c3795","evidence_scope":"full_text","headline":"전력수급 예측오차 연 1.8조원 손실…기상청, 재생E 예측 정밀도 높인다","late_arrival":false,"primary_category":"터빈·공급계약","project_name":null,"region":"전국","representative_article_id":"5e290684febb1dd5c500786c73bfc9e3b9a74457a749f73c402d62a72ea0be4c","source_name":"전기신문","source_published_at":"2026-09-29T04:21:24+00:00","source_url":"https://www.electimes.com/news/articleView.html?idxno=372880","summary":"기상청(청장 이미선)은 29일 정책브리핑을 통해 태양광·풍력 발전량 예측에 활용할 수 있는 고해상도 에너지기상 예측정보를 제공한다고 밝혔다. 일사량과 바람 등을 최대 1km 해상도로 세분화해 제공하고, 내년에는 현재 1시간 단위인 예측정보를 15분 단위 초단기 예측으로 확대할 계획이다.","tags":[],"timestamp_basis":"publisher_article_meta","wind_type":"공통"}],"published_at":"2026-09-30T14:41:12.963161+00:00","revision":1,"schema_version":1,"timezone":"Asia/Seoul","window_end":"2026-09-30T07:30:00+09:00","window_start":"2026-09-29T07:30:00+09:00"}
