{"content_status":"partial","counts":{"eligible_articles":4,"fetched":11,"held":1,"merged_duplicates":0,"published_topics":3},"coverage":{"expected_sources":3,"partial":true,"successful_sources":1},"headline_summary":["“저탄소 발전도 기후재난 견뎌야 넷제로”…제안된 ‘전환 회복탄력성’","GS엔텍, 태안 해상풍력 발전단지 하부구조물 37기 수주","합치면 투자여력?…발전 5社, 2028년엔 이자도 못 메울 판"],"issue_date":"2026-10-01","issue_id":"wind-2026-10-01","items":[{"amount":null,"capacity":null,"capacity_unit":null,"companies":[],"contract_stage":"미확인","currency":null,"event_id":"evt-988bfc90397095f63e864770","evidence_scope":"full_text","headline":"“저탄소 발전도 기후재난 견뎌야 넷제로”…제안된 ‘전환 회복탄력성’","late_arrival":false,"primary_category":"금융·PF","project_name":null,"region":null,"representative_article_id":"080e260837b0c243985a54ad614eefa9cdddbae21e5a801aa5a9e37bf8df79a3","source_name":"전기신문","source_published_at":"2026-09-30T04:35:48+00:00","source_url":"https://www.electimes.com/news/articleView.html?idxno=372937","summary":"태양광·풍력·ESS·송전망 등 에너지 인프라 전반에서도 폭염이나 집중호우 등 극한기후에 대한 대응력이 중요해지고 있다. 현재 국내에서는 재생에너지 확대와 전기화, 첨단산업 및 데이터센터 등에 따른 전력수요 증가가 동시에 진행되면서 재생에너지 설비와 전력망의 안정적인 운영 중요성도 커지고 있다.","tags":[],"timestamp_basis":"publisher_article_meta","wind_type":"공통"},{"amount":null,"capacity":null,"capacity_unit":null,"companies":["GS엔텍","태안풍력발전"],"contract_stage":"미확인","currency":null,"event_id":"evt-a203a04c8313de130f47ca24","evidence_scope":"full_text","headline":"GS엔텍, 태안 해상풍력 발전단지 하부구조물 37기 수주","late_arrival":false,"primary_category":"산업·공급망","project_name":"태안 해상풍력 사업","region":"태안","representative_article_id":"f1b2ed22735c1e11895acbcae17c29773165bfd45c9f4004108e502c68e313eb","source_name":"연합뉴스","source_published_at":"2026-09-30T07:46:52+00:00","source_url":"https://www.yna.co.kr/view/AKR20260930152600003","summary":"GS엔텍은 태안풍력발전과 모노파일 37기 공급 계약을 체결했다고 30일 밝혔다. 2028년 8월까지 순차 납품할 예정이다.","tags":[],"timestamp_basis":"publisher_article_meta","wind_type":"고정식 해상"},{"amount":null,"capacity":null,"capacity_unit":null,"companies":["남동발전","서부발전","중부발전","남부발전","동서발전"],"contract_stage":"미확인","currency":null,"event_id":"evt-08132e9ec345e19586e775b9","evidence_scope":"full_text","headline":"합치면 투자여력?…발전 5社, 2028년엔 이자도 못 메울 판","late_arrival":false,"primary_category":"인허가·정책","project_name":null,"region":null,"representative_article_id":"d6226c4e2e55c847dc0440766128913769511196cd91c363599ff1f97c43d329","source_name":"전기신문","source_published_at":"2026-09-30T06:46:42+00:00","source_url":"https://www.electimes.com/news/articleView.html?idxno=372936","summary":"예산정책처가 500MW급 해상풍력 출자금 7500억원을 차입한다고 가정해 5사의 지난해 말 재무상태에 대입한 결과, 발전사별 부채비율은 11.9~15.2%포인트(p) 올랐지만 합산 기준 상승폭은 2.7%p에 그쳤다. 하지만 통합의 전체 재무효과까지 계산된 것은 아니다.","tags":[],"timestamp_basis":"publisher_article_meta","wind_type":"고정식 해상"}],"published_at":"2026-09-30T23:00:02.193661+00:00","revision":1,"schema_version":1,"timezone":"Asia/Seoul","window_end":"2026-10-01T07:30:00+09:00","window_start":"2026-09-30T07:30:00+09:00"}
